17:18:38.877517 IP 192.168.0.15.43471 > 23.195.155.202.443: Flags [.], ack 1623866279, win 245, options [nop,nop,TS val 43001536 ecr 287517202], length 0
17:18:38.894202 IP 23.195.155.202.443 > 192.168.0.15.43471: Flags [.], ack 1, win 950, options [nop,nop,TS val 287562223 ecr 42990294], length 0
17:18:39.373507 IP 192.168.0.15.53761 > 23.195.213.126.80: Flags [.], ack 3222580025, win 237, options [nop,nop,TS val 43001660 ecr 773822649], length 0
17:18:39.404272 IP 23.195.213.126.80 > 192.168.0.15.53761: Flags [.], ack 1, win 916, options [nop,nop,TS val 773867681 ecr 42990407], length 0
17:18:39.432311 IP 192.168.0.15.17500 > 255.255.255.255.17500: UDP, length 158
17:18:39.433296 IP 192.168.0.15.17500 > 192.168.0.255.17500: UDP, length 158
17:18:40.146761 78:8d:f7:e7:43:e2 Unknown SSAP 0xd2 > 48:51:b7:f6:61:25 Unknown DSAP 0xc4 Information, send seq 0, rcv seq 16, Flags [Response], length 76
17:18:40.225385 IP 192.168.0.15.35494 > 69.89.76.20.80: Flags [F.], seq 373185299, ack 1199812564, win 254, options [nop,nop,TS val 43001872 ecr 2738942397], length 0
17:18:40.346026 IP 69.89.76.20.80 > 192.168.0.15.35494: Flags [.], ack 1, win 36, options [nop,nop,TS val 2738942981 ecr 43001872], length 0
17:18:40.541576 IP 192.168.0.15.59267 > 66.185.85.144.80: Flags [.], ack 1059694600, win 288, options [nop,nop,TS val 43001952 ecr 60973341], length 0
17:18:40.564115 IP 66.185.85.144.80 > 192.168.0.15.59267: Flags [.], ack 1, win 634, options [nop,nop,TS val 61018393 ecr 42990692], length 0
17:18:40.785527 IP 192.168.0.15.47937 > 23.222.72.145.443: Flags [.], ack 1353102955, win 996, options [nop,nop,TS val 43002013 ecr 302929035], length 0
17:18:40.814062 IP 23.222.72.145.443 > 192.168.0.15.47937: Flags [.], ack 1, win 950, options [nop,nop,TS val 302974063 ecr 42990773], length 0
17:18:40.925506 IP 192.168.0.15.39844 > 23.4.112.57.80: Flags [.], ack 76302784, win 466, options [nop,nop,TS val 43002048 ecr 64419205], length 0
17:18:40.964065 IP 23.4.112.57.80 > 192.168.0.15.39844: Flags [.], ack 1, win 916, options [nop,nop,TS val 64464262 ecr 42990792], length 0
17:18:40.973508 IP 192.168.0.15.49749 > 107.23.195.66.80: Flags [.], ack 1510852482, win 240, options [nop,nop,TS val 43002060 ecr 664969318], length 0
17:18:41.025854 IP 107.23.195.66.80 > 192.168.0.15.49749: Flags [.], ack 1, win 82, options [nop,nop,TS val 664980578 ecr 42990810], length 0
17:18:41.405507 IP 192.168.0.15.59268 > 66.185.85.144.80: Flags [.], ack 3969447776, win 1444, options [nop,nop,TS val 43002168 ecr 60974235], length 0
17:18:41.434047 IP 66.185.85.144.80 > 192.168.0.15.59268: Flags [.], ack 1, win 1320, options [nop,nop,TS val 61019263 ecr 42990918], length 0
17:18:41.437509 IP 192.168.0.15.59285 > 66.185.85.144.80: Flags [.], ack 3515744384, win 681, options [nop,nop,TS val 43002176 ecr 60974203], length 0
17:18:41.464070 IP 66.185.85.144.80 > 192.168.0.15.59285: Flags [.], ack 1, win 486, options [nop,nop,TS val 61019294 ecr 42990918], length 0
17:18:41.949512 IP 192.168.0.15.39271 > 75.101.145.216.80: Flags [.], ack 2359310326, win 237, options [nop,nop,TS val 43002304 ecr 2037077622], length 0
17:18:41.984117 IP 75.101.145.216.80 > 192.168.0.15.39271: Flags [.], ack 1, win 64, options [nop,nop,TS val 2037088907 ecr 42991029], length 0
17:18:42.054281 IP 192.168.0.15.44684 > 23.21.132.184.80: Flags [P.], seq 156779004:156780140, ack 4118706614, win 279, options [nop,nop,TS val 43002330 ecr 193716974], length 1136
17:18:42.064568 IP 192.168.0.15.34436 > 66.185.85.146.80: Flags [.], seq 1294206056:1294207504, ack 1006421701, win 1444, options [nop,nop,TS val 43002332 ecr 3551035126], length 1448
17:18:42.067496 IP 192.168.0.15.34436 > 66.185.85.146.80: Flags [P.], seq 1448:2555, ack 1, win 1444, options [nop,nop,TS val 43002333 ecr 3551035126], length 1107
17:18:42.084344 IP 66.185.85.146.80 > 192.168.0.15.34436: Flags [.], ack 2555, win 1320, options [nop,nop,TS val 3551057268 ecr 43002332], length 0
17:18:42.104082 IP 23.21.132.184.80 > 192.168.0.15.44684: Flags [P.], seq 1:214, ack 1136, win 136, options [nop,nop,TS val 193719413 ecr 43002330], length 213
17:18:42.104109 IP 192.168.0.15.44684 > 23.21.132.184.80: Flags [.], ack 214, win 287, options [nop,nop,TS val 43002342 ecr 193719413], length 0
17:18:42.445507 IP 192.168.0.15.60337 > 54.192.54.172.80: Flags [.], ack 3151781235, win 425, options [nop,nop,TS val 43002428 ecr 3636979850], length 0
17:18:42.484142 IP 54.192.54.172.80 > 192.168.0.15.60337: Flags [.], ack 1, win 65, options [nop,nop,TS val 3636984354 ecr 42991178], length 0
17:18:42.525964 IP 66.185.85.146.80 > 192.168.0.15.34436: Flags [.], seq 1:1449, ack 2555, win 1320, options [nop,nop,TS val 3551057710 ecr 43002332], length 1448
17:18:42.526623 IP 66.185.85.146.80 > 192.168.0.15.34436: Flags [.], seq 1449:2897, ack 2555, win 1320, options [nop,nop,TS val 3551057710 ecr 43002332], length 1448
17:18:42.526900 IP 192.168.0.15.34436 > 66.185.85.146.80: Flags [.], ack 2897, win 1444, options [nop,nop,TS val 43002448 ecr 3551057710], length 0
17:18:42.527694 IP 66.185.85.146.80 > 192.168.0.15.34436: Flags [.], seq 2897:14481, ack 2555, win 1320, options [nop,nop,TS val 3551057710 ecr 43002332], length 11584
17:18:42.527716 IP 192.168.0.15.34436 > 66.185.85.146.80: Flags [.], ack 14481, win 1444, options [nop,nop,TS val 43002448 ecr 3551057710], length 0
17:18:42.528794 IP 66.185.85.146.80 > 192.168.0.15.34436: Flags [.], seq 14481:23169, ack 2555, win 1320, options [nop,nop,TS val 3551057710 ecr 43002332], length 8688
17:18:42.528813 IP 192.168.0.15.34436 > 66.185.85.146.80: Flags [.], ack 23169, win 1444, options [nop,nop,TS val 43002448 ecr 3551057710], length 0
17:18:42.545191 IP 192.168.0.15.60030 > 52.2.63.29.80: Flags [.], seq 4113773418:4113774866, ack 850072640, win 270, options [nop,nop,TS val 43002452 ecr 9849626], length 1448
17:18:42.546021 IP 66.185.85.146.80 > 192.168.0.15.34436: Flags [.], seq 23169:24617, ack 2555, win 1320, options [nop,nop,TS val 3551057732 ecr 43002448], length 1448
17:18:42.546033 IP 192.168.0.15.60030 > 52.2.63.29.80: Flags [P.], seq 1448:2050, ack 1, win 270, options [nop,nop,TS val 43002453 ecr 9849626], length 602
17:18:42.546448 IP 66.185.85.146.80 > 192.168.0.15.34436: Flags [.], seq 24617:26065, ack 2555, win 1320, options [nop,nop,TS val 3551057732 ecr 43002448], length 1448
17:18:42.546494 IP 192.168.0.15.34436 > 66.185.85.146.80: Flags [.], ack 26065, win 1444, options [nop,nop,TS val 43002453 ecr 3551057732], length 0
17:18:42.546866 IP 66.185.85.146.80 > 192.168.0.15.34436: Flags [P.], seq 26065:28615, ack 2555, win 1320, options [nop,nop,TS val 3551057732 ecr 43002448], length 2550
17:18:42.546900 IP 192.168.0.15.34436 > 66.185.85.146.80: Flags [.], ack 28615, win 1444, options [nop,nop,TS val 43002453 ecr 3551057732], length 0
17:18:42.554147 IP 192.168.0.15.46496 > 173.194.43.77.80: Flags [P.], seq 1336872793:1336873554, ack 2389457191, win 672, options [nop,nop,TS val 43002455 ecr 743740602], length 761
17:18:42.582404 IP 52.2.63.29.80 > 192.168.0.15.60030: Flags [.], ack 2050, win 136, options [nop,nop,TS val 9855902 ecr 43002452], length 0
17:18:42.583094 IP 52.2.63.29.80 > 192.168.0.15.60030: Flags [P.], seq 1:534, ack 2050, win 136, options [nop,nop,TS val 9855903 ecr 43002452], length 533
17:18:42.583106 IP 192.168.0.15.60030 > 52.2.63.29.80: Flags [.], ack 534, win 279, options [nop,nop,TS val 43002462 ecr 9855903], length 0
17:18:42.584166 IP 52.2.63.29.80 > 192.168.0.15.60030: Flags [P.], seq 534:554, ack 2050, win 136, options [nop,nop,TS val 9855903 ecr 43002452], length 20
17:18:42.584180 IP 192.168.0.15.60030 > 52.2.63.29.80: Flags [.], ack 554, win 279, options [nop,nop,TS val 43002462 ecr 9855903], length 0
17:18:42.624171 IP 173.194.43.77.80 > 192.168.0.15.46496: Flags [P.], seq 1:471, ack 761, win 408, options [nop,nop,TS val 743763039 ecr 43002455], length 470
17:18:42.624213 IP 192.168.0.15.46496 > 173.194.43.77.80: Flags [.], ack 471, win 694, options [nop,nop,TS val 43002472 ecr 743763039], length 0
17:18:42.759863 IP 192.168.0.15.34521 > 66.185.85.146.80: Flags [.], seq 3835253651:3835255099, ack 3887330183, win 1400, options [nop,nop,TS val 43002506 ecr 3551035174], length 1448
17:18:42.762402 IP 192.168.0.15.34436 > 66.185.85.146.80: Flags [.], seq 2555:4003, ack 28615, win 1444, options [nop,nop,TS val 43002507 ecr 3551057732], length 1448
17:18:42.762728 IP 192.168.0.15.34435 > 66.185.85.146.80: Flags [.], seq 2962638922:2962640370, ack 3405347710, win 1439, options [nop,nop,TS val 43002507 ecr 3551035099], length 1448
17:18:42.762767 IP 192.168.0.15.34521 > 66.185.85.146.80: Flags [P.], seq 1448:1788, ack 1, win 1400, options [nop,nop,TS val 43002507 ecr 3551035174], length 340
17:18:42.762806 IP 192.168.0.15.34439 > 66.185.85.146.80: Flags [.], seq 497981500:497982948, ack 100337969, win 1444, options [nop,nop,TS val 43002507 ecr 3551035096], length 1448
17:18:42.762876 IP 192.168.0.15.34433 > 66.185.85.146.80: Flags [.], seq 2918195886:2918197334, ack 1188587458, win 1621, options [nop,nop,TS val 43002507 ecr 3551035099], length 1448
17:18:42.762946 IP 192.168.0.15.34437 > 66.185.85.146.80: Flags [.], seq 2731098891:2731100339, ack 845271855, win 1139, options [nop,nop,TS val 43002507 ecr 3551030461], length 1448
17:18:42.765404 IP 192.168.0.15.34437 > 66.185.85.146.80: Flags [P.], seq 1448:2599, ack 1, win 1139, options [nop,nop,TS val 43002507 ecr 3551030461], length 1151
17:18:42.765448 IP 192.168.0.15.34433 > 66.185.85.146.80: Flags [P.], seq 1448:2613, ack 1, win 1621, options [nop,nop,TS val 43002507 ecr 3551035099], length 1165
17:18:42.765459 IP 192.168.0.15.34439 > 66.185.85.146.80: Flags [P.], seq 1448:2617, ack 1, win 1444, options [nop,nop,TS val 43002507 ecr 3551035096], length 1169
17:18:42.765471 IP 192.168.0.15.34435 > 66.185.85.146.80: Flags [P.], seq 1448:2598, ack 1, win 1439, options [nop,nop,TS val 43002507 ecr 3551035099], length 1150
17:18:42.765481 IP 192.168.0.15.34436 > 66.185.85.146.80: Flags [P.], seq 4003:5145, ack 28615, win 1444, options [nop,nop,TS val 43002507 ecr 3551057732], length 1142
17:18:42.768575 IP 192.168.0.15.43944 > 23.235.44.249.80: Flags [P.], seq 3733793505:3733794005, ack 1103663615, win 399, options [nop,nop,TS val 43002508 ecr 549968123], length 500
17:18:42.768655 IP 192.168.0.15.34438 > 66.185.85.146.80: Flags [.], seq 3329184718:3329186166, ack 1301204671, win 366, options [nop,nop,TS val 43002508 ecr 3551028605], length 1448
17:18:42.781702 IP 66.185.85.146.80 > 192.168.0.15.34436: Flags [.], ack 5145, win 1320, options [nop,nop,TS val 3551057968 ecr 43002507], length 0
17:18:42.782335 IP 66.185.85.146.80 > 192.168.0.15.34436: Flags [P.], seq 28615:28827, ack 5145, win 1320, options [nop,nop,TS val 3551057969 ecr 43002507], length 212
17:18:42.784031 IP 66.185.85.146.80 > 192.168.0.15.34521: Flags [.], ack 1788, win 996, options [nop,nop,TS val 3551057969 ecr 43002506], length 0
17:18:42.785360 IP 66.185.85.146.80 > 192.168.0.15.34437: Flags [.], ack 2599, win 1320, options [nop,nop,TS val 3551057969 ecr 43002507], length 0
17:18:42.785770 IP 66.185.85.146.80 > 192.168.0.15.34433: Flags [.], ack 2613, win 1320, options [nop,nop,TS val 3551057969 ecr 43002507], length 0
17:18:42.786067 IP 66.185.85.146.80 > 192.168.0.15.34439: Flags [.], ack 2617, win 1320, options [nop,nop,TS val 3551057970 ecr 43002507], length 0
17:18:42.786396 IP 66.185.85.146.80 > 192.168.0.15.34435: Flags [.], ack 2598, win 1320, options [nop,nop,TS val 3551057970 ecr 43002507], length 0
17:18:42.786873 IP 66.185.85.146.80 > 192.168.0.15.34521: Flags [P.], seq 2897:6324, ack 1788, win 996, options [nop,nop,TS val 3551057970 ecr 43002506], length 3427
17:18:42.786887 IP 192.168.0.15.34521 > 66.185.85.146.80: Flags [.], ack 1, win 1404, options [nop,nop,TS val 43002513 ecr 3551057969,nop,nop,sack 1 {2897:6324}], length 0
17:18:42.787292 IP 66.185.85.146.80 > 192.168.0.15.34437: Flags [P.], seq 1:213, ack 2599, win 1320, options [nop,nop,TS val 3551057970 ecr 43002507], length 212
17:18:42.787300 IP 192.168.0.15.34437 > 66.185.85.146.80: Flags [.], ack 213, win 1161, options [nop,nop,TS val 43002513 ecr 3551057970], length 0
17:18:42.787689 IP 66.185.85.146.80 > 192.168.0.15.34521: Flags [.], seq 1:1449, ack 1788, win 996, options [nop,nop,TS val 3551057970 ecr 43002506], length 1448
17:18:42.787698 IP 192.168.0.15.34521 > 66.185.85.146.80: Flags [.], ack 1449, win 1393, options [nop,nop,TS val 43002513 ecr 3551057970,nop,nop,sack 1 {2897:6324}], length 0
17:18:42.788404 IP 66.185.85.146.80 > 192.168.0.15.34521: Flags [.], seq 1449:2897, ack 1788, win 996, options [nop,nop,TS val 3551057970 ecr 43002506], length 1448
17:18:42.788449 IP 192.168.0.15.34521 > 66.185.85.146.80: Flags [.], ack 6324, win 1467, options [nop,nop,TS val 43002513 ecr 3551057970], length 0
17:18:42.789001 IP 66.185.85.146.80 > 192.168.0.15.34439: Flags [P.], seq 1:213, ack 2617, win 1320, options [nop,nop,TS val 3551057971 ecr 43002507], length 212
17:18:42.789023 IP 192.168.0.15.34439 > 66.185.85.146.80: Flags [.], ack 213, win 1443, options [nop,nop,TS val 43002513 ecr 3551057971], length 0
17:18:42.789235 IP 66.185.85.146.80 > 192.168.0.15.34435: Flags [P.], seq 1:212, ack 2598, win 1320, options [nop,nop,TS val 3551057973 ecr 43002507], length 211
17:18:42.789249 IP 192.168.0.15.34435 > 66.185.85.146.80: Flags [.], ack 212, win 1438, options [nop,nop,TS val 43002513 ecr 3551057973], length 0
17:18:42.800287 IP 192.168.0.15.34438 > 66.185.85.146.80: Flags [P.], seq 1448:2592, ack 1, win 366, options [nop,nop,TS val 43002516 ecr 3551028605], length 1144
17:18:42.801774 IP 192.168.0.15.34435 > 66.185.85.146.80: Flags [.], seq 2598:4046, ack 212, win 1439, options [nop,nop,TS val 43002517 ecr 3551057973], length 1448
17:18:42.802419 IP 192.168.0.15.34435 > 66.185.85.146.80: Flags [P.], seq 4046:5257, ack 212, win 1439, options [nop,nop,TS val 43002517 ecr 3551057973], length 1211
17:18:42.804655 IP 66.185.85.146.80 > 192.168.0.15.34433: Flags [P.], seq 1:213, ack 2613, win 1320, options [nop,nop,TS val 3551057988 ecr 43002507], length 212
17:18:42.804704 IP 192.168.0.15.34433 > 66.185.85.146.80: Flags [.], ack 213, win 1621, options [nop,nop,TS val 43002517 ecr 3551057988], length 0
17:18:42.814661 IP 66.185.85.146.80 > 192.168.0.15.34435: Flags [P.], seq 212:408, ack 5257, win 1320, options [nop,nop,TS val 3551058000 ecr 43002517], length 196
17:18:42.815175 IP 66.185.85.146.80 > 192.168.0.15.34435: Flags [.], ack 5257, win 1320, options [nop,nop,TS val 3551058000 ecr 43002517], length 0
17:18:42.815686 IP 66.185.85.146.80 > 192.168.0.15.34435: Flags [.], ack 5257, win 1320, options [nop,nop,TS val 3551058002 ecr 43002517], length 0
17:18:42.817231 IP 66.185.85.146.80 > 192.168.0.15.34438: Flags [.], ack 2592, win 1320, options [nop,nop,TS val 3551058002 ecr 43002508], length 0
17:18:42.817819 IP 66.185.85.146.80 > 192.168.0.15.34438: Flags [P.], seq 1:212, ack 2592, win 1320, options [nop,nop,TS val 3551058003 ecr 43002508], length 211
17:18:42.817830 IP 192.168.0.15.34438 > 66.185.85.146.80: Flags [.], ack 212, win 383, options [nop,nop,TS val 43002521 ecr 3551058003], length 0
17:18:42.821509 IP 192.168.0.15.34436 > 66.185.85.146.80: Flags [.], ack 28827, win 1444, options [nop,nop,TS val 43002522 ecr 3551057969], length 0
17:18:42.830558 IP 192.168.0.15.34438 > 66.185.85.146.80: Flags [.], seq 2592:4040, ack 212, win 383, options [nop,nop,TS val 43002524 ecr 3551058003], length 1448
17:18:42.833011 IP 192.168.0.15.34438 > 66.185.85.146.80: Flags [P.], seq 4040:5224, ack 212, win 383, options [nop,nop,TS val 43002524 ecr 3551058003], length 1184
17:18:42.853080 IP 66.185.85.146.80 > 192.168.0.15.34438: Flags [.], ack 2592, win 1320, options [nop,nop,TS val 3551058038 ecr 43002521,nop,nop,sack 1 {4040:5224}], length 0
17:18:42.853507 IP 192.168.0.15.34435 > 66.185.85.146.80: Flags [.], ack 408, win 1439, options [nop,nop,TS val 43002530 ecr 3551058000], length 0
17:18:42.857548 IP 192.168.0.15.34438 > 66.185.85.146.80: Flags [.], seq 2592:4040, ack 212, win 383, options [nop,nop,TS val 43002531 ecr 3551058038], length 1448
17:18:42.861172 IP 66.185.85.146.80 > 192.168.0.15.34438: Flags [.], ack 5224, win 1298, options [nop,nop,TS val 3551058038 ecr 43002524], length 0
17:18:42.864128 IP 23.235.44.249.80 > 192.168.0.15.43944: Flags [P.], seq 1:267, ack 500, win 70, options [nop,nop,TS val 549974657 ecr 43002508], length 266
17:18:42.864153 IP 192.168.0.15.43944 > 23.235.44.249.80: Flags [.], ack 267, win 422, options [nop,nop,TS val 43002532 ecr 549974657], length 0
17:18:42.867822 IP 192.168.0.15.34435 > 66.185.85.146.80: Flags [.], seq 5257:6705, ack 408, win 1439, options [nop,nop,TS val 43002533 ecr 3551058000], length 1448
17:18:42.867896 IP 192.168.0.15.34521 > 66.185.85.146.80: Flags [.], seq 1788:3236, ack 6324, win 1467, options [nop,nop,TS val 43002533 ecr 3551057970], length 1448
17:18:42.867957 IP 192.168.0.15.34522 > 66.185.85.146.80: Flags [.], seq 4192309109:4192310557, ack 4101737320, win 848, options [nop,nop,TS val 43002533 ecr 3551032106], length 1448
17:18:42.868016 IP 192.168.0.15.34519 > 66.185.85.146.80: Flags [.], seq 907511276:907512724, ack 2417610150, win 812, options [nop,nop,TS val 43002533 ecr 3551032106], length 1448
17:18:42.868080 IP 192.168.0.15.34433 > 66.185.85.146.80: Flags [.], seq 2613:4061, ack 213, win 1621, options [nop,nop,TS val 43002533 ecr 3551057988], length 1448
17:18:42.868142 IP 192.168.0.15.34439 > 66.185.85.146.80: Flags [.], seq 2617:4065, ack 213, win 1444, options [nop,nop,TS val 43002533 ecr 3551057971], length 1448
17:18:42.870393 IP 66.185.85.146.80 > 192.168.0.15.34438: Flags [.], ack 5224, win 1320, options [nop,nop,TS val 3551058056 ecr 43002524,nop,nop,sack 1 {2592:4040}], length 0
17:18:42.870413 IP 192.168.0.15.34435 > 66.185.85.146.80: Flags [P.], seq 6705:7829, ack 408, win 1439, options [nop,nop,TS val 43002534 ecr 3551058000], length 1124
17:18:42.871890 IP 66.185.85.146.80 > 192.168.0.15.34438: Flags [.], seq 212:3108, ack 5224, win 1320, options [nop,nop,TS val 3551058058 ecr 43002524], length 2896
17:18:42.871903 IP 192.168.0.15.34438 > 66.185.85.146.80: Flags [.], ack 3108, win 428, options [nop,nop,TS val 43002534 ecr 3551058058], length 0
17:18:42.871913 IP 192.168.0.15.34522 > 66.185.85.146.80: Flags [P.], seq 1448:1814, ack 1, win 848, options [nop,nop,TS val 43002534 ecr 3551032106], length 366
17:18:42.871919 IP 192.168.0.15.34521 > 66.185.85.146.80: Flags [P.], seq 3236:3576, ack 6324, win 1467, options [nop,nop,TS val 43002534 ecr 3551057970], length 340
17:18:42.873367 IP 192.168.0.15.34433 > 66.185.85.146.80: Flags [P.], seq 4061:5211, ack 213, win 1621, options [nop,nop,TS val 43002534 ecr 3551057988], length 1150
17:18:42.873401 IP 192.168.0.15.34519 > 66.185.85.146.80: Flags [P.], seq 1448:1806, ack 1, win 812, options [nop,nop,TS val 43002534 ecr 3551032106], length 358
17:18:42.877630 IP 66.185.85.146.80 > 192.168.0.15.34438: Flags [.], seq 3108:23380, ack 5224, win 1320, options [nop,nop,TS val 3551058058 ecr 43002524], length 20272
17:18:42.877703 IP 192.168.0.15.34438 > 66.185.85.146.80: Flags [.], ack 23380, win 745, options [nop,nop,TS val 43002536 ecr 3551058058], length 0
17:18:42.877736 IP 192.168.0.15.34439 > 66.185.85.146.80: Flags [P.], seq 4065:5278, ack 213, win 1444, options [nop,nop,TS val 43002536 ecr 3551057971], length 1213
17:18:42.881506 IP 192.168.0.15.56488 > 24.156.140.82.80: Flags [.], ack 951258511, win 462, options [nop,nop,TS val 43002537 ecr 1682911142], length 0
17:18:42.889650 IP 66.185.85.146.80 > 192.168.0.15.34435: Flags [.], ack 7829, win 1320, options [nop,nop,TS val 3551058076 ecr 43002533], length 0
17:18:42.890456 IP 66.185.85.146.80 > 192.168.0.15.34435: Flags [P.], seq 408:907, ack 7829, win 1320, options [nop,nop,TS val 3551058076 ecr 43002533], length 499
17:18:42.890469 IP 192.168.0.15.34435 > 66.185.85.146.80: Flags [.], ack 907, win 1436, options [nop,nop,TS val 43002539 ecr 3551058076], length 0
17:18:42.891774 IP 66.185.85.146.80 > 192.168.0.15.34438: Flags [.], seq 23380:24828, ack 5224, win 1320, options [nop,nop,TS val 3551058078 ecr 43002534], length 1448
17:18:42.892197 IP 66.185.85.146.80 > 192.168.0.15.34438: Flags [P.], seq 24828:26276, ack 5224, win 1320, options [nop,nop,TS val 3551058078 ecr 43002534], length 1448
17:18:42.892203 IP 192.168.0.15.34438 > 66.185.85.146.80: Flags [.], ack 26276, win 790, options [nop,nop,TS val 43002539 ecr 3551058078], length 0
17:18:42.892209 IP 66.185.85.146.80 > 192.168.0.15.34521: Flags [.], ack 3576, win 1177, options [nop,nop,TS val 3551058078 ecr 43002533], length 0
17:18:42.893190 IP 66.185.85.146.80 > 192.168.0.15.34521: Flags [.], seq 6324:7772, ack 3576, win 1177, options [nop,nop,TS val 3551058079 ecr 43002533], length 1448
17:18:42.893196 IP 192.168.0.15.34521 > 66.185.85.146.80: Flags [.], ack 7772, win 1489, options [nop,nop,TS val 43002539 ecr 3551058079], length 0
17:18:42.894088 IP 66.185.85.146.80 > 192.168.0.15.34521: Flags [.], seq 7772:12116, ack 3576, win 1177, options [nop,nop,TS val 3551058079 ecr 43002533], length 4344
17:18:42.894095 IP 192.168.0.15.34521 > 66.185.85.146.80: Flags [.], ack 12116, win 1557, options [nop,nop,TS val 43002540 ecr 3551058079], length 0
17:18:42.894892 IP 66.185.85.146.80 > 192.168.0.15.34521: Flags [.], seq 12116:15012, ack 3576, win 1177, options [nop,nop,TS val 3551058079 ecr 43002533], length 2896
17:18:42.894899 IP 192.168.0.15.34521 > 66.185.85.146.80: Flags [.], ack 15012, win 1603, options [nop,nop,TS val 43002540 ecr 3551058079], length 0
17:18:42.895647 IP 66.185.85.146.80 > 192.168.0.15.34521: Flags [P.], seq 15012:16166, ack 3576, win 1177, options [nop,nop,TS val 3551058079 ecr 43002533], length 1154
17:18:42.895655 IP 192.168.0.15.34521 > 66.185.85.146.80: Flags [.], ack 16166, win 1625, options [nop,nop,TS val 43002540 ecr 3551058079], length 0
17:18:42.895668 IP 66.185.85.146.80 > 192.168.0.15.34438: Flags [P.], seq 26276:28827, ack 5224, win 1320, options [nop,nop,TS val 3551058080 ecr 43002536], length 2551
17:18:42.895674 IP 192.168.0.15.34438 > 66.185.85.146.80: Flags [.], ack 28827, win 830, options [nop,nop,TS val 43002540 ecr 3551058080], length 0
17:18:42.896516 IP 66.185.85.146.80 > 192.168.0.15.34433: Flags [.], ack 5211, win 1320, options [nop,nop,TS val 3551058080 ecr 43002533], length 0
17:18:42.897646 IP 66.185.85.146.80 > 192.168.0.15.34522: Flags [.], ack 1814, win 908, options [nop,nop,TS val 3551058080 ecr 43002533], length 0
17:18:42.898022 IP 66.185.85.146.80 > 192.168.0.15.34439: Flags [.], ack 5278, win 1320, options [nop,nop,TS val 3551058081 ecr 43002533], length 0
17:18:42.898376 IP 66.185.85.146.80 > 192.168.0.15.34519: Flags [.], ack 1806, win 815, options [nop,nop,TS val 3551058081 ecr 43002533], length 0
17:18:42.899229 IP 66.185.85.146.80 > 192.168.0.15.34522: Flags [.], seq 46337:47785, ack 1814, win 908, options [nop,nop,TS val 3551058082 ecr 43002533], length 1448
17:18:42.899240 IP 192.168.0.15.34522 > 66.185.85.146.80: Flags [.], ack 1, win 870, options [nop,nop,TS val 43002541 ecr 3551058080,nop,nop,sack 1 {46337:47785}], length 0
17:18:42.900746 IP 66.185.85.146.80 > 192.168.0.15.34522: Flags [P.], seq 47785:55025, ack 1814, win 908, options [nop,nop,TS val 3551058082 ecr 43002533], length 7240
17:18:42.900757 IP 192.168.0.15.34522 > 66.185.85.146.80: Flags [.], ack 1, win 983, options [nop,nop,TS val 43002541 ecr 3551058080,nop,nop,sack 1 {46337:55025}], length 0
17:18:42.900769 IP 66.185.85.146.80 > 192.168.0.15.34522: Flags [.], seq 55025:60817, ack 1814, win 908, options [nop,nop,TS val 3551058082 ecr 43002533], length 5792
17:18:42.900772 IP 192.168.0.15.34522 > 66.185.85.146.80: Flags [.], ack 1, win 1074, options [nop,nop,TS val 43002541 ecr 3551058080,nop,nop,sack 1 {46337:60817}], length 0
17:18:42.900778 IP 66.185.85.146.80 > 192.168.0.15.34522: Flags [.], seq 1:1449, ack 1814, win 908, options [nop,nop,TS val 3551058082 ecr 43002533], length 1448
17:18:42.900786 IP 192.168.0.15.34522 > 66.185.85.146.80: Flags [.], ack 1449, win 1097, options [nop,nop,TS val 43002541 ecr 3551058082,nop,nop,sack 1 {46337:60817}], length 0
17:18:42.903331 IP 66.185.85.146.80 > 192.168.0.15.34522: Flags [.], seq 1449:5793, ack 1814, win 908, options [nop,nop,TS val 3551058082 ecr 43002533], length 4344
17:18:42.903341 IP 192.168.0.15.34522 > 66.185.85.146.80: Flags [.], ack 5793, win 1164, options [nop,nop,TS val 43002542 ecr 3551058082,nop,nop,sack 1 {46337:60817}], length 0
17:18:42.903346 IP 66.185.85.146.80 > 192.168.0.15.34519: Flags [.], seq 2897:28961, ack 1806, win 815, options [nop,nop,TS val 3551058083 ecr 43002533], length 26064
17:18:42.903352 IP 192.168.0.15.34519 > 66.185.85.146.80: Flags [.], ack 1, win 1161, options [nop,nop,TS val 43002542 ecr 3551058081,nop,nop,sack 1 {2897:28961}], length 0
17:18:42.905908 IP 66.185.85.146.80 > 192.168.0.15.34519: Flags [.], seq 28961:47785, ack 1806, win 815, options [nop,nop,TS val 3551058083 ecr 43002533], length 18824
17:18:42.905921 IP 192.168.0.15.34519 > 66.185.85.146.80: Flags [.], ack 1, win 1161, options [nop,nop,TS val 43002543 ecr 3551058081,nop,nop,sack 1 {2897:47785}], length 0
17:18:42.905927 IP 66.185.85.146.80 > 192.168.0.15.34522: Flags [.], seq 5793:17377, ack 1814, win 908, options [nop,nop,TS val 3551058082 ecr 43002533], length 11584
17:18:42.905933 IP 192.168.0.15.34522 > 66.185.85.146.80: Flags [.], ack 17377, win 1113, options [nop,nop,TS val 43002543 ecr 3551058082,nop,nop,sack 1 {46337:60817}], length 0
17:18:42.908357 IP 66.185.85.146.80 > 192.168.0.15.34519: Flags [P.], seq 47785:52129, ack 1806, win 815, options [nop,nop,TS val 3551058083 ecr 43002533], length 4344
17:18:42.908413 IP 192.168.0.15.34519 > 66.185.85.146.80: Flags [.], ack 1, win 1161, options [nop,nop,TS val 43002543 ecr 3551058081,nop,nop,sack 1 {2897:52129}], length 0
17:18:42.908486 IP 66.185.85.146.80 > 192.168.0.15.34522: Flags [.], seq 17377:28961, ack 1814, win 908, options [nop,nop,TS val 3551058082 ecr 43002533], length 11584
17:18:42.908505 IP 192.168.0.15.34522 > 66.185.85.146.80: Flags [.], ack 28961, win 1023, options [nop,nop,TS val 43002543 ecr 3551058082,nop,nop,sack 1 {46337:60817}], length 0
17:18:42.908510 IP 66.185.85.146.80 > 192.168.0.15.34519: Flags [.], seq 52129:62265, ack 1806, win 815, options [nop,nop,TS val 3551058083 ecr 43002533], length 10136
17:18:42.908521 IP 192.168.0.15.34519 > 66.185.85.146.80: Flags [.], ack 1, win 1161, options [nop,nop,TS val 43002543 ecr 3551058081,nop,nop,sack 1 {2897:62265}], length 0
17:18:42.909298 IP 66.185.85.146.80 > 192.168.0.15.34522: Flags [.], seq 28961:40545, ack 1814, win 908, options [nop,nop,TS val 3551058082 ecr 43002533], length 11584
17:18:42.909312 IP 192.168.0.15.34522 > 66.185.85.146.80: Flags [.], ack 40545, win 933, options [nop,nop,TS val 43002543 ecr 3551058082,nop,nop,sack 1 {46337:60817}], length 0
17:18:42.910286 IP 66.185.85.146.80 > 192.168.0.15.34522: Flags [.], seq 40545:46337, ack 1814, win 908, options [nop,nop,TS val 3551058082 ecr 43002533], length 5792
17:18:42.910320 IP 192.168.0.15.34522 > 66.185.85.146.80: Flags [.], ack 60817, win 790, options [nop,nop,TS val 43002544 ecr 3551058082], length 0
17:18:42.910863 IP 66.185.85.146.80 > 192.168.0.15.34519: Flags [.], seq 1:1449, ack 1806, win 815, options [nop,nop,TS val 3551058083 ecr 43002533], length 1448
17:18:42.910877 IP 192.168.0.15.34519 > 66.185.85.146.80: Flags [.], ack 1449, win 1150, options [nop,nop,TS val 43002544 ecr 3551058083,nop,nop,sack 1 {2897:62265}], length 0
17:18:42.911989 IP 24.156.140.82.80 > 192.168.0.15.56488: Flags [.], ack 1, win 520, options [nop,nop,TS val 1682956160 ecr 42991287], length 0
17:18:42.911995 IP 66.185.85.146.80 > 192.168.0.15.34519: Flags [.], seq 1449:2897, ack 1806, win 815, options [nop,nop,TS val 3551058083 ecr 43002533], length 1448
17:18:42.912006 IP 192.168.0.15.34519 > 66.185.85.146.80: Flags [.], ack 62265, win 768, options [nop,nop,TS val 43002544 ecr 3551058083], length 0
17:18:42.912011 IP 66.185.85.146.80 > 192.168.0.15.34522: Flags [.], seq 1:1449, ack 1814, win 908, options [nop,nop,TS val 3551058098 ecr 43002541], length 1448
17:18:42.912015 IP 192.168.0.15.34522 > 66.185.85.146.80: Flags [.], ack 60817, win 790, options [nop,nop,TS val 43002544 ecr 3551058082,nop,nop,sack 1 {1:1449}], length 0
17:18:42.912712 IP 66.185.85.146.80 > 192.168.0.15.34522: Flags [.], seq 1449:4345, ack 1814, win 908, options [nop,nop,TS val 3551058098 ecr 43002541], length 2896
17:18:42.912722 IP 192.168.0.15.34522 > 66.185.85.146.80: Flags [.], ack 60817, win 1164, options [nop,nop,TS val 43002544 ecr 3551058082,nop,nop,sack 1 {1449:4345}], length 0
17:18:42.913407 IP 66.185.85.146.80 > 192.168.0.15.34522: Flags [.], seq 4345:7241, ack 1814, win 908, options [nop,nop,TS val 3551058098 ecr 43002541], length 2896
17:18:42.913411 IP 192.168.0.15.34522 > 66.185.85.146.80: Flags [.], ack 60817, win 1164, options [nop,nop,TS val 43002544 ecr 3551058082,nop,nop,sack 1 {4345:7241}], length 0
17:18:42.914169 IP 66.185.85.146.80 > 192.168.0.15.34522: Flags [.], seq 60817:63713, ack 1814, win 908, options [nop,nop,TS val 3551058098 ecr 43002541], length 2896
17:18:42.914175 IP 192.168.0.15.34522 > 66.185.85.146.80: Flags [.], ack 63713, win 1210, options [nop,nop,TS val 43002545 ecr 3551058098], length 0
17:18:42.914634 IP 66.185.85.146.80 > 192.168.0.15.34522: Flags [.], seq 63713:66609, ack 1814, win 908, options [nop,nop,TS val 3551058098 ecr 43002541], length 2896
17:18:42.914641 IP 192.168.0.15.34522 > 66.185.85.146.80: Flags [.], ack 66609, win 1255, options [nop,nop,TS val 43002545 ecr 3551058098], length 0
17:18:42.914955 IP 66.185.85.146.80 > 192.168.0.15.34522: Flags [.], seq 66609:68057, ack 1814, win 908, options [nop,nop,TS val 3551058098 ecr 43002541], length 1448
17:18:42.914960 IP 192.168.0.15.34522 > 66.185.85.146.80: Flags [.], ack 68057, win 1278, options [nop,nop,TS val 43002545 ecr 3551058098], length 0
17:18:42.915629 IP 66.185.85.146.80 > 192.168.0.15.34522: Flags [P.], seq 68057:69505, ack 1814, win 908, options [nop,nop,TS val 3551058098 ecr 43002541], length 1448
17:18:42.915634 IP 192.168.0.15.34522 > 66.185.85.146.80: Flags [.], ack 69505, win 1300, options [nop,nop,TS val 43002545 ecr 3551058098], length 0
17:18:42.917245 IP 66.185.85.146.80 > 192.168.0.15.34522: Flags [.], seq 7241:18825, ack 1814, win 908, options [nop,nop,TS val 3551058102 ecr 43002541], length 11584
17:18:42.917253 IP 192.168.0.15.34522 > 66.185.85.146.80: Flags [.], ack 69505, win 1300, options [nop,nop,TS val 43002545 ecr 3551058098,nop,nop,sack 1 {7241:18825}], length 0
17:18:42.917972 IP 66.185.85.146.80 > 192.168.0.15.34522: Flags [.], seq 18825:21721, ack 1814, win 908, options [nop,nop,TS val 3551058102 ecr 43002541], length 2896
17:18:42.917978 IP 192.168.0.15.34522 > 66.185.85.146.80: Flags [.], ack 69505, win 1300, options [nop,nop,TS val 43002546 ecr 3551058098,nop,nop,sack 1 {18825:21721}], length 0
17:18:42.919605 IP 66.185.85.146.80 > 192.168.0.15.34522: Flags [.], seq 21721:23169, ack 1814, win 908, options [nop,nop,TS val 3551058106 ecr 43002542], length 1448
17:18:42.919612 IP 192.168.0.15.34522 > 66.185.85.146.80: Flags [.], ack 69505, win 1300, options [nop,nop,TS val 43002546 ecr 3551058098,nop,nop,sack 1 {21721:23169}], length 0
17:18:42.920610 IP 66.185.85.146.80 > 192.168.0.15.34522: Flags [.], seq 23169:26065, ack 1814, win 908, options [nop,nop,TS val 3551058106 ecr 43002542], length 2896
17:18:42.920620 IP 192.168.0.15.34522 > 66.185.85.146.80: Flags [.], ack 69505, win 1300, options [nop,nop,TS val 43002546 ecr 3551058098,nop,nop,sack 1 {23169:26065}], length 0
17:18:42.921071 IP 66.185.85.146.80 > 192.168.0.15.34522: Flags [.], seq 26065:28961, ack 1814, win 908, options [nop,nop,TS val 3551058106 ecr 43002542], length 2896
17:18:42.921078 IP 192.168.0.15.34522 > 66.185.85.146.80: Flags [.], ack 69505, win 1300, options [nop,nop,TS val 43002546 ecr 3551058098,nop,nop,sack 1 {26065:28961}], length 0
17:18:42.921993 IP 66.185.85.146.80 > 192.168.0.15.34522: Flags [.], seq 28961:30409, ack 1814, win 908, options [nop,nop,TS val 3551058106 ecr 43002542], length 1448
17:18:42.922000 IP 192.168.0.15.34522 > 66.185.85.146.80: Flags [.], ack 69505, win 1300, options [nop,nop,TS val 43002547 ecr 3551058098,nop,nop,sack 1 {28961:30409}], length 0
17:18:42.922380 IP 66.185.85.146.80 > 192.168.0.15.34522: Flags [.], seq 30409:31857, ack 1814, win 908, options [nop,nop,TS val 3551058106 ecr 43002542], length 1448
17:18:42.922382 IP 192.168.0.15.34522 > 66.185.85.146.80: Flags [.], ack 69505, win 1300, options [nop,nop,TS val 43002547 ecr 3551058098,nop,nop,sack 1 {30409:31857}], length 0
17:18:42.922807 IP 66.185.85.146.80 > 192.168.0.15.34522: Flags [.], seq 31857:34753, ack 1814, win 908, options [nop,nop,TS val 3551058106 ecr 43002542], length 2896
17:18:42.922812 IP 192.168.0.15.34522 > 66.185.85.146.80: Flags [.], ack 69505, win 1300, options [nop,nop,TS val 43002547 ecr 3551058098,nop,nop,sack 1 {31857:34753}], length 0
17:18:42.923435 IP 66.185.85.146.80 > 192.168.0.15.34522: Flags [.], seq 34753:36201, ack 1814, win 908, options [nop,nop,TS val 3551058106 ecr 43002542], length 1448
17:18:42.923440 IP 192.168.0.15.34522 > 66.185.85.146.80: Flags [.], ack 69505, win 1300, options [nop,nop,TS val 43002547 ecr 3551058098,nop,nop,sack 1 {34753:36201}], length 0
17:18:42.923827 IP 66.185.85.146.80 > 192.168.0.15.34522: Flags [.], seq 36201:37649, ack 1814, win 908, options [nop,nop,TS val 3551058110 ecr 43002543], length 1448
17:18:42.923832 IP 192.168.0.15.34522 > 66.185.85.146.80: Flags [.], ack 69505, win 1300, options [nop,nop,TS val 43002547 ecr 3551058098,nop,nop,sack 1 {36201:37649}], length 0
17:18:42.924894 IP 66.185.85.146.80 > 192.168.0.15.34522: Flags [.], seq 37649:39097, ack 1814, win 908, options [nop,nop,TS val 3551058110 ecr 43002543], length 1448
17:18:42.924899 IP 192.168.0.15.34522 > 66.185.85.146.80: Flags [.], ack 69505, win 1300, options [nop,nop,TS val 43002547 ecr 3551058098,nop,nop,sack 1 {37649:39097}], length 0
17:18:42.930696 IP 66.185.85.146.80 > 192.168.0.15.34519: Flags [.], seq 1:2897, ack 1806, win 815, options [nop,nop,TS val 3551058110 ecr 43002543], length 2896
17:18:42.930715 IP 192.168.0.15.34519 > 66.185.85.146.80: Flags [.], ack 62265, win 1219, options [nop,nop,TS val 43002549 ecr 3551058083,nop,nop,sack 1 {1:2897}], length 0
17:18:42.930733 IP 66.185.85.146.80 > 192.168.0.15.34519: Flags [P.], seq 62265:70953, ack 1806, win 815, options [nop,nop,TS val 3551058110 ecr 43002543], length 8688
17:18:42.930738 IP 192.168.0.15.34519 > 66.185.85.146.80: Flags [.], ack 70953, win 1355, options [nop,nop,TS val 43002549 ecr 3551058110], length 0
17:18:42.930747 IP 66.185.85.146.80 > 192.168.0.15.34522: Flags [.], seq 39097:46337, ack 1814, win 908, options [nop,nop,TS val 3551058110 ecr 43002543], length 7240
17:18:42.930750 IP 192.168.0.15.34522 > 66.185.85.146.80: Flags [.], ack 69505, win 1300, options [nop,nop,TS val 43002549 ecr 3551058098,nop,nop,sack 1 {39097:46337}], length 0
17:18:42.930757 IP 66.185.85.146.80 > 192.168.0.15.34522: Flags [.], seq 69505:73849, ack 1814, win 908, options [nop,nop,TS val 3551058110 ecr 43002543], length 4344
17:18:42.930759 IP 192.168.0.15.34522 > 66.185.85.146.80: Flags [.], ack 73849, win 1368, options [nop,nop,TS val 43002549 ecr 3551058110], length 0
17:18:42.930959 IP 66.185.85.146.80 > 192.168.0.15.34522: Flags [.], seq 73849:81089, ack 1814, win 908, options [nop,nop,TS val 3551058110 ecr 43002543], length 7240
17:18:42.930964 IP 192.168.0.15.34522 > 66.185.85.146.80: Flags [.], ack 81089, win 1481, options [nop,nop,TS val 43002549 ecr 3551058110], length 0
17:18:42.933183 IP 66.185.85.146.80 > 192.168.0.15.34522: Flags [.], seq 81089:107153, ack 1814, win 908, options [nop,nop,TS val 3551058110 ecr 43002543], length 26064
17:18:42.933201 IP 192.168.0.15.34522 > 66.185.85.146.80: Flags [.], ack 107153, win 1888, options [nop,nop,TS val 43002549 ecr 3551058110], length 0
17:18:42.933214 IP 66.185.85.146.80 > 192.168.0.15.34522: Flags [.], seq 107153:110049, ack 1814, win 908, options [nop,nop,TS val 3551058115 ecr 43002543], length 2896
17:18:42.933217 IP 192.168.0.15.34522 > 66.185.85.146.80: Flags [.], ack 110049, win 1934, options [nop,nop,TS val 43002549 ecr 3551058115], length 0
17:18:42.935907 IP 66.185.85.146.80 > 192.168.0.15.34522: Flags [.], seq 110049:118737, ack 1814, win 908, options [nop,nop,TS val 3551058115 ecr 43002543], length 8688
17:18:42.935953 IP 192.168.0.15.34522 > 66.185.85.146.80: Flags [.], ack 118737, win 2069, options [nop,nop,TS val 43002550 ecr 3551058115], length 0
17:18:42.936012 IP 66.185.85.146.80 > 192.168.0.15.34522: Flags [.], seq 118737:124529, ack 1814, win 908, options [nop,nop,TS val 3551058115 ecr 43002544], length 5792
17:18:42.936016 IP 66.185.85.146.80 > 192.168.0.15.34519: Flags [.], seq 70953:83985, ack 1806, win 815, options [nop,nop,TS val 3551058115 ecr 43002544], length 13032
17:18:42.936026 IP 192.168.0.15.34519 > 66.185.85.146.80: Flags [.], ack 83985, win 1308, options [nop,nop,TS val 43002550 ecr 3551058115], length 0
17:18:42.936039 IP 192.168.0.15.34522 > 66.185.85.146.80: Flags [.], ack 124529, win 2160, options [nop,nop,TS val 43002550 ecr 3551058115], length 0
17:18:42.936068 IP 66.185.85.146.80 > 192.168.0.15.34519: Flags [.], seq 83985:86881, ack 1806, win 815, options [nop,nop,TS val 3551058115 ecr 43002544], length 2896
17:18:42.936075 IP 192.168.0.15.34519 > 66.185.85.146.80: Flags [.], ack 86881, win 1286, options [nop,nop,TS val 43002550 ecr 3551058115], length 0
17:18:42.938629 IP 66.185.85.146.80 > 192.168.0.15.34519: Flags [.], seq 86881:117289, ack 1806, win 815, options [nop,nop,TS val 3551058115 ecr 43002544], length 30408
17:18:42.938648 IP 192.168.0.15.34519 > 66.185.85.146.80: Flags [.], ack 117289, win 1113, options [nop,nop,TS val 43002551 ecr 3551058115], length 0
17:18:42.939755 IP 66.185.85.146.80 > 192.168.0.15.34433: Flags [P.], seq 213:569, ack 5211, win 1320, options [nop,nop,TS val 3551058117 ecr 43002533], length 356
17:18:42.939768 IP 192.168.0.15.34433 > 66.185.85.146.80: Flags [.], ack 569, win 1643, options [nop,nop,TS val 43002551 ecr 3551058117], length 0
17:18:42.939781 IP 66.185.85.146.80 > 192.168.0.15.34439: Flags [P.], seq 213:569, ack 5278, win 1320, options [nop,nop,TS val 3551058119 ecr 43002533], length 356
17:18:42.939785 IP 192.168.0.15.34439 > 66.185.85.146.80: Flags [.], ack 569, win 1442, options [nop,nop,TS val 43002551 ecr 3551058119], length 0
17:18:42.939799 IP 66.185.85.146.80 > 192.168.0.15.34519: Flags [.], seq 117289:127425, ack 1806, win 815, options [nop,nop,TS val 3551058115 ecr 43002544], length 10136
17:18:42.939804 IP 192.168.0.15.34519 > 66.185.85.146.80: Flags [.], ack 127425, win 1513, options [nop,nop,TS val 43002551 ecr 3551058115], length 0
17:18:42.939808 IP 66.185.85.146.80 > 192.168.0.15.34522: Flags [.], seq 124529:127425, ack 1814, win 908, options [nop,nop,TS val 3551058120 ecr 43002545], length 2896
17:18:42.939811 IP 192.168.0.15.34522 > 66.185.85.146.80: Flags [.], ack 127425, win 2205, options [nop,nop,TS val 43002551 ecr 3551058120], length 0
17:18:42.952207 IP 66.185.85.146.80 > 192.168.0.15.34519: Flags [.], seq 127425:128873, ack 1806, win 815, options [nop,nop,TS val 3551058138 ecr 43002549], length 1448
17:18:42.952247 IP 192.168.0.15.34519 > 66.185.85.146.80: Flags [.], ack 128873, win 1536, options [nop,nop,TS val 43002554 ecr 3551058138], length 0
17:18:42.952618 IP 66.185.85.146.80 > 192.168.0.15.34519: Flags [.], seq 128873:130321, ack 1806, win 815, options [nop,nop,TS val 3551058138 ecr 43002549], length 1448
17:18:42.952626 IP 192.168.0.15.34519 > 66.185.85.146.80: Flags [.], ack 130321, win 1558, options [nop,nop,TS val 43002554 ecr 3551058138], length 0
17:18:42.954279 IP 66.185.85.146.80 > 192.168.0.15.34519: Flags [.], seq 130321:136113, ack 1806, win 815, options [nop,nop,TS val 3551058138 ecr 43002549], length 5792
